{
  "type": "member-end-plate",
  "title": "Member End Plate",
  "version": 1,
  "roles": {
    "endPlate": "_end_plate",
    "holePattern": "_bolt_grid",
    "plateHoles": "_holes_plate",
    "memberHoles": "_holes_main",
    "fasteners": "_bolts",
    "weld": "_beam_weld",
    "beamTrimPlane": "_beam_trim_plane",
    "beamTrim": "_beam_trim"
  },
  "componentRefs": [
    "design-status"
  ],
  "parameters": {
    "plate.thickness": {
      "kind": "positiveNumber",
      "label": "Plate thickness",
      "unit": "mm"
    },
    "plate.width": {
      "kind": "positiveNumber",
      "label": "Plate width",
      "unit": "mm"
    },
    "plate.height": {
      "kind": "positiveNumber",
      "label": "Plate height",
      "unit": "mm"
    },
    "plate.offset": {
      "kind": "number",
      "label": "Plate offset",
      "unit": "mm"
    },
    "bolts.fastenerRef": {
      "kind": "catalogRef",
      "catalog": "fasteners",
      "label": "Fastener",
      "readOnly": true
    },
    "bolts.rows": {
      "kind": "positiveInteger",
      "label": "Rows",
      "unit": "pcs"
    },
    "bolts.columns": {
      "kind": "positiveInteger",
      "label": "Columns",
      "unit": "pcs"
    },
    "bolts.pitch": {
      "kind": "nonNegativeNumber",
      "label": "Pitch",
      "unit": "mm"
    },
    "bolts.gauge": {
      "kind": "nonNegativeNumber",
      "label": "Gauge",
      "unit": "mm"
    },
    "holes.diameter": {
      "kind": "positiveNumber",
      "label": "Hole diameter",
      "unit": "mm"
    },
    "holes.memberDepth": {
      "kind": "positiveNumber",
      "label": "Member depth",
      "unit": "mm"
    },
    "holes.type": {
      "kind": "enum",
      "values": [
        "round",
        "slotted",
        "countersunk"
      ],
      "label": "Hole type",
      "readOnly": true
    },
    "welds.beamWeb": {
      "kind": "positiveNumber",
      "label": "Web weld",
      "unit": "mm"
    },
    "welds.beamFlanges": {
      "kind": "positiveNumber",
      "label": "Flange weld",
      "unit": "mm"
    }
  },
  "dimensions": [
    {
      "id": "end-plate-thickness",
      "parameter": "plate.thickness",
      "label": "t",
      "reference": {
        "kind": "plate-axis",
        "objectRole": "endPlate",
        "axis": "normal",
        "at": {
          "localAxisY": "max",
          "localAxisZ": "max"
        },
        "offset": {
          "localAxisY": 24,
          "localAxisZ": 18
        }
      }
    },
    {
      "id": "end-plate-width",
      "parameter": "plate.width",
      "label": "W",
      "reference": {
        "kind": "plate-axis",
        "objectRole": "endPlate",
        "axis": "localAxisY",
        "at": {
          "localAxisZ": "max"
        },
        "offset": {
          "localAxisZ": 28,
          "normal": 18
        }
      }
    },
    {
      "id": "end-plate-height",
      "parameter": "plate.height",
      "label": "H",
      "reference": {
        "kind": "plate-axis",
        "objectRole": "endPlate",
        "axis": "localAxisZ",
        "at": {
          "localAxisY": "min"
        },
        "offset": {
          "localAxisY": -32,
          "normal": 18
        }
      }
    },
    {
      "id": "end-plate-offset",
      "parameter": "plate.offset",
      "label": "offset",
      "reference": {
        "kind": "interface-offset",
        "interfaceRole": "main",
        "objectRole": "endPlate",
        "offset": {
          "localAxisZ": -28,
          "normal": 24
        }
      }
    },
    {
      "id": "bolt-pattern",
      "parameter": "bolts.rows",
      "label": "bolts",
      "reference": {
        "kind": "bolt-pattern",
        "holePatternRole": "holePattern",
        "featureRole": "plateHoles",
        "rowsParameter": "bolts.rows",
        "columnsParameter": "bolts.columns",
        "offset": {
          "localAxisY": 38,
          "normal": 28
        }
      }
    },
    {
      "id": "bolt-pitch",
      "parameter": "bolts.pitch",
      "label": "P",
      "reference": {
        "kind": "hole-spacing",
        "holePatternRole": "holePattern",
        "featureRole": "plateHoles",
        "axis": "localAxisZ",
        "offset": {
          "localAxisY": -32,
          "normal": 22
        }
      }
    },
    {
      "id": "bolt-gauge",
      "parameter": "bolts.gauge",
      "label": "G",
      "reference": {
        "kind": "hole-spacing",
        "holePatternRole": "holePattern",
        "featureRole": "plateHoles",
        "axis": "localAxisY",
        "offset": {
          "localAxisZ": -26,
          "normal": 22
        }
      }
    }
  ],
  "ui": {
    "tabs": [
      {
        "id": "parts",
        "label": "Parts",
        "items": [
          "plate.thickness",
          "plate.width",
          "plate.height",
          {
            "kind": "connectionPlates"
          }
        ]
      },
      {
        "id": "bolts",
        "label": "Bolts",
        "items": [
          "bolts.fastenerRef",
          "bolts.rows",
          "bolts.columns",
          "bolts.pitch",
          "bolts.gauge",
          "holes.diameter",
          "holes.memberDepth"
        ]
      },
      {
        "id": "welds",
        "label": "Welds",
        "items": [
          "welds.beamWeb",
          "welds.beamFlanges"
        ]
      }
    ]
  },
  "$schema": "../../../../../../app/schemas/connection-component.schema.json"
}
