{
  "type": "design-status",
  "title": "Design Status",
  "version": 1,
  "parameters": {
    "designAssumptions.standard": {
      "kind": "text",
      "label": "Standard",
      "readOnly": true
    },
    "designAssumptions.status": {
      "kind": "text",
      "label": "Calculation",
      "readOnly": true
    },
    "loads.status": {
      "kind": "text",
      "label": "Loads",
      "readOnly": true
    }
  },
  "ui": {
    "tabs": [
      {
        "id": "design",
        "label": "Design",
        "items": [
          "designAssumptions.standard",
          "designAssumptions.status",
          "loads.status"
        ]
      }
    ]
  },
  "$schema": "../../../../../../app/schemas/connection-component.schema.json"
}
